{
  "manifestVersion": 1,
  "id": "weave-basic-flight",
  "slug": "weave-basic-flight",
  "type": "weave-mod",
  "name": "WeaveBasicFlight",
  "summary": "Adds a command that toggles vanilla flight.",
  "description": "Adds a command that toggles vanilla flight.",
  "authors": [
    {
      "name": "Tryflle",
      "url": "https://github.com/Tryflle"
    }
  ],
  "source": {
    "repository": "https://github.com/Tryflle/weavebasicflight",
    "archived": false,
    "license": "GPL-3.0-only",
    "licenseUrl": "https://github.com/Tryflle/weavebasicflight/blob/main/LICENSE",
    "latestCommit": {
      "sha": "693ae37f7af564ea5680ba2d38a7d7b5c272972f",
      "date": "2023-09-23T00:20:21-04:00"
    },
    "automaticRedistributionPermitted": true,
    "notes": ""
  },
  "localizations": {
    "en": {
      "name": "WeaveBasicFlight",
      "summary": "Adds a command that toggles vanilla flight.",
      "description": "Adds a command that toggles vanilla flight.",
      "warnings": [
        "This behavior may provide an unfair advantage and may be prohibited by server rules."
      ],
      "changelog": "Upstream release."
    },
    "ru": {
      "name": "WeaveBasicFlight",
      "summary": "Добавляет команду для включения и выключения ванильного полёта.",
      "description": "Добавляет команду для включения и выключения ванильного полёта.",
      "warnings": [
        "Эта функция может давать нечестное преимущество и может быть запрещена правилами сервера."
      ],
      "changelog": "Релиз вышестоящего проекта."
    }
  },
  "supportedMinecraftVersions": [
    "1.8.9"
  ],
  "supportedClientVersions": [],
  "compatibilityNotes": "The project uses the Weave 1.8.9 development configuration.",
  "riskLevel": "unfair-advantage",
  "installPolicy": "confirmation-required",
  "restricted": true,
  "featured": false,
  "recommended": false,
  "distribution": {
    "mode": "github-release",
    "url": "https://github.com/Tryflle/weavebasicflight/releases",
    "reason": ""
  },
  "releases": [
    {
      "version": "2.0",
      "publishedAt": "2023-09-23T03:54:40Z",
      "changelog": {
        "en": "Upstream release.",
        "ru": "Релиз вышестоящего проекта."
      },
      "asset": {
        "url": "https://github.com/Tryflle/weavebasicflight/releases/download/2.0/WeaveBasicFlight-2.0.jar",
        "fileName": "WeaveBasicFlight-2.0.jar",
        "fileSize": 4556,
        "sha256": "fa68f01a865afb66632ffc163a308a7e0b25284cb0a420f6f8a0bc9a10849931"
      }
    }
  ],
  "warnings": [
    {
      "code": "server-rules",
      "en": "This behavior may provide an unfair advantage and may be prohibited by server rules.",
      "ru": "Эта функция может давать нечестное преимущество и может быть запрещена правилами сервера."
    }
  ],
  "inspection": {
    "manifestType": "weave.mod.json",
    "entryPoints": [
      "com.tryfle.basicflight.FlyingMod"
    ],
    "observedFileName": null,
    "observedSha256": null,
    "observedSize": null,
    "notes": ""
  },
  "todos": []
}
