{
  "manifestVersion": 1,
  "id": "mm-utils",
  "slug": "mm-utils",
  "type": "weave-mod",
  "name": "MMUtils",
  "summary": "Detects Murder Mystery roles and provides gold and player ESP on Hypixel.",
  "description": "Detects Murder Mystery roles and provides gold and player ESP on Hypixel.",
  "authors": [
    {
      "name": "imyanice",
      "url": "https://github.com/imyanice"
    }
  ],
  "source": {
    "repository": "https://github.com/imyanice/mm-utils",
    "archived": false,
    "license": null,
    "licenseUrl": null,
    "latestCommit": {
      "sha": "ae3cdc8fcc2e4e067fa2d6f1969fbae2d76ad283",
      "date": "2026-05-20T21:54:14+02:00"
    },
    "automaticRedistributionPermitted": "unknown",
    "notes": ""
  },
  "localizations": {
    "en": {
      "name": "MMUtils",
      "summary": "Detects Murder Mystery roles and provides gold and player ESP on Hypixel.",
      "description": "Detects Murder Mystery roles and provides gold and player ESP on Hypixel.",
      "warnings": [
        "This behavior may provide an unfair advantage and may be prohibited by server rules.",
        "No clear upstream license was found. Moonrise does not redistribute this binary.",
        "Upstream explicitly lists Gold ESP and Player ESP."
      ],
      "changelog": "Upstream release."
    },
    "ru": {
      "name": "MMUtils",
      "summary": "Определяет роли в Murder Mystery и добавляет ESP золота и игроков на Hypixel.",
      "description": "Определяет роли в Murder Mystery и добавляет ESP золота и игроков на Hypixel.",
      "warnings": [
        "Эта функция может давать нечестное преимущество и может быть запрещена правилами сервера.",
        "Явная лицензия вышестоящего проекта не найдена. Moonrise не распространяет этот бинарный файл.",
        "Автор прямо указывает Gold ESP и Player ESP."
      ],
      "changelog": "Релиз вышестоящего проекта."
    }
  },
  "supportedMinecraftVersions": [
    "1.8.9"
  ],
  "supportedClientVersions": [
    "Lunar Client"
  ],
  "compatibilityNotes": "Upstream explicitly calls the mod Lunar Client compatible; its code uses the Weave 1.8.9 API.",
  "riskLevel": "unfair-advantage",
  "installPolicy": "external-download",
  "restricted": true,
  "featured": false,
  "recommended": false,
  "distribution": {
    "mode": "external-page",
    "url": "https://github.com/imyanice/mm-utils/releases/tag/v2.1.0",
    "reason": ""
  },
  "releases": [
    {
      "version": "2.1.0",
      "publishedAt": "2026-05-20T19:54:44Z",
      "changelog": {
        "en": "Upstream release.",
        "ru": "Релиз вышестоящего проекта."
      },
      "asset": {
        "url": "https://github.com/imyanice/mm-utils/releases/download/v2.1.0/MMUtils-2.1.0.jar",
        "fileName": "MMUtils-2.1.0.jar",
        "fileSize": 16054,
        "sha256": "6f8c72b4facfa2bac203143969c3c366765f733b816b984816f51368879672bf"
      }
    }
  ],
  "warnings": [
    {
      "code": "server-rules",
      "en": "This behavior may provide an unfair advantage and may be prohibited by server rules.",
      "ru": "Эта функция может давать нечестное преимущество и может быть запрещена правилами сервера."
    },
    {
      "code": "missing-license",
      "en": "No clear upstream license was found. Moonrise does not redistribute this binary.",
      "ru": "Явная лицензия вышестоящего проекта не найдена. Moonrise не распространяет этот бинарный файл."
    },
    {
      "code": "esp",
      "en": "Upstream explicitly lists Gold ESP and Player ESP.",
      "ru": "Автор прямо указывает Gold ESP и Player ESP."
    }
  ],
  "inspection": {
    "manifestType": "weave.mod.json",
    "entryPoints": [
      "me.yanjobs.mmutils.MMUtils"
    ],
    "observedFileName": null,
    "observedSha256": null,
    "observedSize": null,
    "notes": ""
  },
  "todos": []
}
